{
  "bolt": "US-000.BOLT-005",
  "bolt_ref": "devflow/functional/bolts/US-000.BOLT-005-carga-de-providers-lazy.md",
  "spec": "SPEC-261016-0015",
  "spec_ref": "devflow/spec/SPEC-261016-0015-carga-de-providers-lazy.md",
  "spec_revision": 1,
  "produced_by": "agent:dotnet-developer-agent",
  "produced_at": "2026-10-16T02:03:34-03:00",
  "purpose": "Constancia de las rupturas que introduce el retiro de la superficie de carga de providers (ADR-008 §3.1: qué desaparece, por qué decisión y con qué se reemplaza) y del punto de entrada NUEVO del camino por entidad, para las notas de migración del consumidor, cuyo documento es del Bolt 028. Convención de fragmento por Bolt (SPECs 002/003/006/011): cada Bolt aporta su fragmento versionado junto al código y su cobertura se cruza contra el reporte del gate de compatibilidad de API en ApiRemovalCoverageTests. El gate reporta las diferencias de miembro en AMBAS direcciones: las entradas de retiro (kind *-removed) y la de adición (kind member-added) cubren todas las del ensamblado Cooperator.Framework.Core.",
  "source_of_shape": "Cooperator.Framework.Core.Factory (SingleFactory + FactoryCache) y Cooperator.Framework.Core.LazyLoad (la carga de providers) del 1.4 congelado, y su superficie 2.0 entregada por este Bolt",
  "entries": [
    {
      "id": "BOLT005-01",
      "kind": "method-removed",
      "surface": "public",
      "type": "Cooperator.Framework.Core.Factory.SingleFactory",
      "member": "CreateObject",
      "signature": "public static object CreateObject(string assemblyPath, string assemblyName, string className)",
      "what": "Desaparece la sobrecarga de carga por RUTA: abría el ensamblado con Assembly.LoadFrom(assemblyPath + assemblyName). Es la superficie que convertía un valor de configuración en ejecución de código desde una ruta arbitraria.",
      "why": "ADR-006 §3.1 y §4: el runtime moderno no justifica la carga por ruta y el framework no la tolera; ninguna clave de configuración puede provocar una carga desde una ruta.",
      "replacement": "Ninguno dentro del framework: cargar desde una carpeta o una ruta es la política del HOST y entra por el hook (IAssemblyProvider, registrado una vez con ProviderResolution.Register). El framework sólo resuelve por nombre de un destino declarado.",
      "owner_bolt": "US-000.BOLT-005",
      "status": "executed-here",
      "evidence": "No existe en 2.0/src (la búsqueda de Assembly.LoadFrom/LoadFile sobre el código propio da 0, y el control no es vacuo: el 1.4 congelado sí la contiene); el gate la reporta como miembro retirado cubierto por esta entrada (NoImplicitLoadingTests, ApiRemovalCoverageTests)."
    },
    {
      "id": "BOLT005-02",
      "kind": "method-removed",
      "surface": "public",
      "type": "Cooperator.Framework.Core.Factory.SingleFactory",
      "member": "CreateObject",
      "signature": "public static object CreateObject(string assemblyName, string className)",
      "what": "Desaparece la construcción por NOMBRE SIMPLE sin calificar: Assembly.Load(<nombre simple>) + CreateInstance(className, true) con el binder por defecto, que resolvía contra el AppDomain sondeando el directorio base y degradaba cualquier fallo en un NullReferenceException o un 'file not found' lejos de la configuración que lo causó.",
      "why": "ADR-006 §3.1/§3.3 (REV-001 F-02): el ALC por defecto no sondea directorios y el nombre debe identificar unívocamente el destino.",
      "replacement": "Cooperator.Framework.Core.LazyLoad.LazyProviderFactory.Get(<ensamblado simple>, <tipo completo calificado>) —que resuelve con Assembly.Load(new AssemblyName(<simple>)) + tipo por nombre completo— y, para el camino por entidad, LazyProviderFactory.GetForEntity(<entidad>), que lee el catálogo de ADR-004 §3.2. La caché pasa a ProviderCache. La construcción tipada que NO carga por nombre (SingleFactory.CreateObject(Type) y CreateObject<T>()) se conserva.",
      "owner_bolt": "US-000.BOLT-005",
      "status": "executed-here",
      "evidence": "El ensamblado 2.0 no expone esa sobrecarga (el gate la reporta y esta entrada la cubre); los casos del cuadro de diagnósticos prueban que cada causa produce su excepción tipada con la clave y los nombres intentados (ProviderDiagnosticsTests)."
    },
    {
      "id": "BOLT005-03",
      "kind": "type-removed",
      "surface": "public",
      "type": "Cooperator.Framework.Core.Factory.FactoryCache",
      "member": "FactoryCache",
      "signature": "public static class FactoryCache (Dictionary<string, object> estático con clave $\\\"{assemblyName}.{className}\\\")",
      "what": "Desaparece la caché de instancias con CLAVE CONCATENADA por puntos y sin sincronización: dos pares distintos podían colisionar ((\\\"A.B\\\",\\\"C\\\") vs (\\\"A\\\",\\\"B.C\\\")) y el Dictionary estático podía corromperse bajo concurrencia.",
      "why": "ADR-006 §3.2 (REV-001 F-02): la caché es thread-safe, con clave por nombre calificado, con reinicio explícito y sin cachear fallos.",
      "replacement": "Cooperator.Framework.Core.LazyLoad.ProviderCache: una instancia por provider y por proceso, clave por ProviderName (igualdad estructural sobre el par, sin colisión), thread-safe y con ProviderCache.Reset() explícito.",
      "owner_bolt": "US-000.BOLT-005",
      "status": "executed-here",
      "evidence": "ProviderCacheTests: corrida concurrente con conteo de instancias (una sola), pares que colisionaban como claves distintas, reinicio explícito y fallo no cacheado. El tipo FactoryCache no existe en 2.0/src."
    },
    {
      "id": "BOLT005-04",
      "kind": "behavior-change",
      "surface": "internal",
      "type": "Cooperator.Framework.Core.LazyLoad.ProviderResolver",
      "member": "",
      "signature": "(sin superficie: es una semántica de resolución)",
      "what": "El SONDEO IMPLÍCITO por directorio base desaparece como camino de resolución: un ensamblado presente en el despliegue pero no declarado como dependencia ya no se encuentra. Y el mecanismo de la carpeta CooperatorAssemblies deja de existir en runtime (su contraparte de compilación ya murió con los PackageReference).",
      "why": "ADR-006 §3.1/§5 (NFR no-implicit-assembly-loading): 0 llamadas a LoadFrom/LoadFile y 0 sondeo de directorio en el camino por defecto.",
      "replacement": "Declarar el provider como DEPENDENCIA de la aplicación (el caso de la plantilla DefaultLazyProvider: el provider se genera en el proyecto de reglas del cliente) o registrar el hook del host con su propia política de carga. Es un cambio de despliegue deliberado y documentado (ADR-006 §4).",
      "owner_bolt": "US-000.BOLT-005",
      "status": "executed-here",
      "evidence": "NoImplicitLoadingTests: el ensamblado de prueba existe en una subcarpeta del despliegue y NO está declarado (0 ocurrencias en el deps.json); la resolución por defecto falla con el nombre intentado y la causa del runtime, y el hook del host —con su AssemblyLoadContext— sí lo obtiene."
    },
    {
      "id": "BOLT005-05",
      "kind": "member-added",
      "surface": "public",
      "type": "Cooperator.Framework.Core.LazyLoad.LazyProviderFactory",
      "member": "GetForEntity",
      "signature": "public static ILazyProvider GetForEntity(string entity)",
      "what": "Se AGREGA al contrato de la fábrica el camino por ENTIDAD: resuelve los nombres del catálogo de configuración (Cooperator:LazyLoad:Providers:<entidad>:Assembly y …:Class, ADR-004 §3.2) y es el camino donde la ausencia de configuración tiene diagnóstico propio con la entidad y la clave esperada.",
      "why": "SPEC-261016-0015 §6/A.3 y §14: el código generado ya invoca la fábrica por nombre explícito y el camino por entidad es el que hace que la ProviderNotConfiguredException tenga sentido (ADR-006 §3.3, primera fila).",
      "replacement": "No reemplaza nada: es una ADICIÓN a la superficie del contrato de la fábrica (el gate de compatibilidad la reporta como diferencia de miembro en la dirección de adición). Un consumidor puede seguir usando LazyProviderFactory.Get(ensamblado, tipo) como hasta ahora.",
      "owner_bolt": "US-000.BOLT-005",
      "status": "executed-here",
      "evidence": "ProviderResolutionTests: el camino por entidad resuelve por la vía del host y reporta la entidad y la clave esperada cuando falta configuración; el gate lo reporta como diferencia de miembro cubierta por esta entrada (ApiRemovalCoverageTests)."
    }
  ],
  "registered_obligations": []
}
